{
  "$schema": "https://json-schema.org/draft/2020-12/schema",
  "$id": "https://ulisescm.github.io/navori-harness/schema/navori.config.v1.json",
  "title": "navori.config.json",
  "description": "Source-of-truth config checked into a repo that uses navori. `navori render` reconstructs the harness from this file.",
  "type": "object",
  "properties": {
    "$schema": {
      "type": "string"
    },
    "name": {
      "type": "string",
      "pattern": "^[a-z0-9][a-z0-9-]*$"
    },
    "version": {
      "default": "1.0.0",
      "type": "string"
    },
    "harnessVersion": {
      "type": "string"
    },
    "workspace": {
      "type": "string",
      "pattern": "^[a-z0-9][a-z0-9-]*$"
    },
    "engines": {
      "minItems": 1,
      "type": "array",
      "items": {
        "type": "string",
        "enum": [
          "claude",
          "agents-md",
          "cursor",
          "copilot",
          "codex",
          "pi"
        ]
      }
    },
    "preset": {
      "type": "string",
      "minLength": 1
    },
    "language": {
      "default": "es",
      "type": "string",
      "enum": [
        "es",
        "en"
      ]
    },
    "branchBase": {
      "default": "main",
      "type": "string"
    },
    "gitignoreHarness": {
      "default": "off",
      "type": "string",
      "enum": [
        "off",
        "local",
        "full"
      ]
    },
    "prTarget": {
      "type": "string"
    },
    "commits": {
      "default": "conventional-es",
      "type": "string",
      "enum": [
        "conventional",
        "conventional-es",
        "free"
      ]
    },
    "qualityGate": {
      "type": "object",
      "properties": {
        "fast": {
          "type": "string",
          "minLength": 1
        },
        "full": {
          "type": "string",
          "minLength": 1
        },
        "scoped": {
          "type": "string",
          "minLength": 1
        },
        "affected": {
          "type": "string",
          "minLength": 1
        },
        "docs": {
          "type": "string",
          "minLength": 1
        },
        "nativeHooks": {
          "type": "boolean"
        }
      },
      "required": [
        "fast",
        "full"
      ],
      "additionalProperties": false
    },
    "hooks": {
      "type": "object",
      "properties": {
        "verifyOnStop": {
          "default": false,
          "type": "boolean"
        }
      },
      "required": [
        "verifyOnStop"
      ],
      "additionalProperties": false
    },
    "audit": {
      "default": {
        "mode": "opt-in"
      },
      "type": "object",
      "properties": {
        "mode": {
          "default": "opt-in",
          "type": "string",
          "enum": [
            "opt-in",
            "always"
          ]
        }
      },
      "required": [
        "mode"
      ],
      "additionalProperties": false
    },
    "packageManager": {
      "type": "string",
      "enum": [
        "pnpm",
        "npm",
        "yarn",
        "bun"
      ]
    },
    "sdd": {
      "type": "object",
      "properties": {
        "deliveries": {
          "type": "object",
          "properties": {
            "splitMinTasks": {
              "type": "integer",
              "minimum": 1,
              "maximum": 9007199254740991
            },
            "splitMinLoc": {
              "type": "integer",
              "minimum": 1,
              "maximum": 9007199254740991
            },
            "maxPrsPerSpec": {
              "type": "integer",
              "minimum": 2,
              "maximum": 9007199254740991
            }
          },
          "additionalProperties": false
        },
        "enabled": {
          "default": true,
          "type": "boolean"
        },
        "specsDir": {
          "default": "specs",
          "type": "string"
        },
        "applyWhen": {
          "default": [],
          "type": "array",
          "items": {
            "type": "string"
          }
        },
        "doesNotApplyTo": {
          "default": [],
          "type": "array",
          "items": {
            "type": "string"
          }
        }
      },
      "required": [
        "enabled",
        "specsDir",
        "applyWhen",
        "doesNotApplyTo"
      ],
      "additionalProperties": false
    },
    "harness": {
      "type": "object",
      "properties": {
        "orchestrator": {
          "default": true,
          "type": "boolean"
        },
        "implementer": {
          "default": true,
          "type": "boolean"
        },
        "reviewer": {
          "default": true,
          "type": "boolean"
        },
        "scout": {
          "default": true,
          "type": "boolean"
        },
        "auditor": {
          "default": true,
          "type": "boolean"
        },
        "publisher": {
          "default": true,
          "type": "boolean"
        },
        "scribe": {
          "default": true,
          "type": "boolean"
        },
        "scribeOwnsMarkdown": {
          "default": false,
          "type": "boolean"
        },
        "planTiers": {
          "default": false,
          "type": "boolean"
        },
        "codexIntegration": {
          "default": false,
          "type": "boolean"
        },
        "masterPlan": {
          "default": false,
          "type": "boolean"
        },
        "compactAdviceTokens": {
          "default": 175000,
          "type": "integer",
          "minimum": 0,
          "maximum": 9007199254740991
        }
      },
      "required": [
        "orchestrator",
        "implementer",
        "reviewer",
        "scout",
        "auditor",
        "publisher",
        "scribe",
        "scribeOwnsMarkdown",
        "planTiers",
        "codexIntegration",
        "masterPlan",
        "compactAdviceTokens"
      ],
      "additionalProperties": false
    },
    "models": {
      "type": "object",
      "properties": {
        "codexProfiles": {
          "type": "object",
          "propertyNames": {
            "type": "string",
            "pattern": "^[a-zA-Z0-9][a-zA-Z0-9_-]*$"
          },
          "additionalProperties": {
            "type": "object",
            "properties": {
              "model": {
                "type": "string",
                "minLength": 1
              },
              "effort": {
                "type": "string",
                "enum": [
                  "low",
                  "medium",
                  "high",
                  "xhigh",
                  "max"
                ]
              }
            },
            "additionalProperties": false
          },
          "description": "Per-native-agent Codex overrides; orchestrator is reserved for the main thread"
        },
        "orchestrator": {
          "type": "string",
          "enum": [
            "opus",
            "sonnet",
            "haiku"
          ]
        },
        "implementer": {
          "type": "string",
          "enum": [
            "opus",
            "sonnet",
            "haiku"
          ]
        },
        "reviewer": {
          "type": "string",
          "enum": [
            "opus",
            "sonnet",
            "haiku"
          ]
        },
        "scout": {
          "type": "string",
          "enum": [
            "opus",
            "sonnet",
            "haiku"
          ]
        },
        "auditor": {
          "type": "string",
          "enum": [
            "opus",
            "sonnet",
            "haiku"
          ]
        },
        "publisher": {
          "type": "string",
          "enum": [
            "opus",
            "sonnet",
            "haiku"
          ]
        },
        "scribe": {
          "type": "string",
          "enum": [
            "opus",
            "sonnet",
            "haiku"
          ]
        },
        "architect": {
          "type": "string",
          "enum": [
            "opus",
            "sonnet",
            "haiku"
          ]
        },
        "codexMap": {
          "type": "object",
          "properties": {
            "opus": {
              "type": "string",
              "description": "Codex model family (sol, luna, astra: highest-version model in the local Codex catalog) or a full model id (pinned verbatim)"
            },
            "sonnet": {
              "type": "string",
              "description": "Codex model family (sol, luna, astra: highest-version model in the local Codex catalog) or a full model id (pinned verbatim)"
            },
            "haiku": {
              "type": "string",
              "description": "Codex model family (sol, luna, astra: highest-version model in the local Codex catalog) or a full model id (pinned verbatim)"
            }
          },
          "additionalProperties": false
        }
      },
      "additionalProperties": false
    },
    "effort": {
      "type": "object",
      "properties": {
        "orchestrator": {
          "type": "string",
          "enum": [
            "low",
            "medium",
            "high",
            "xhigh",
            "max"
          ]
        },
        "implementer": {
          "type": "string",
          "enum": [
            "low",
            "medium",
            "high",
            "xhigh",
            "max"
          ]
        },
        "reviewer": {
          "type": "string",
          "enum": [
            "low",
            "medium",
            "high",
            "xhigh",
            "max"
          ]
        },
        "scout": {
          "type": "string",
          "enum": [
            "low",
            "medium",
            "high",
            "xhigh",
            "max"
          ]
        },
        "auditor": {
          "type": "string",
          "enum": [
            "low",
            "medium",
            "high",
            "xhigh",
            "max"
          ]
        },
        "publisher": {
          "type": "string",
          "enum": [
            "low",
            "medium",
            "high",
            "xhigh",
            "max"
          ]
        },
        "scribe": {
          "type": "string",
          "enum": [
            "low",
            "medium",
            "high",
            "xhigh",
            "max"
          ]
        },
        "architect": {
          "type": "string",
          "enum": [
            "low",
            "medium",
            "high",
            "xhigh",
            "max"
          ]
        }
      },
      "additionalProperties": false
    },
    "plugins": {
      "type": "object",
      "propertyNames": {
        "type": "string"
      },
      "additionalProperties": {
        "type": "object",
        "properties": {
          "enabled": {
            "type": "boolean"
          },
          "nativeHook": {
            "type": "boolean"
          }
        },
        "required": [
          "enabled"
        ],
        "additionalProperties": false
      }
    },
    "blocks": {
      "type": "object",
      "properties": {
        "exclude": {
          "default": [],
          "type": "array",
          "items": {
            "type": "string"
          }
        }
      },
      "required": [
        "exclude"
      ],
      "additionalProperties": false
    },
    "progress": {
      "type": "object",
      "properties": {
        "dir": {
          "default": "progress",
          "type": "string",
          "minLength": 1
        },
        "currentFile": {
          "default": "current.md",
          "type": "string",
          "minLength": 1
        },
        "historyFile": {
          "default": "history.md",
          "type": "string",
          "minLength": 1
        }
      },
      "required": [
        "dir",
        "currentFile",
        "historyFile"
      ],
      "additionalProperties": false
    },
    "project": {
      "type": "object",
      "properties": {
        "legacyPaths": {
          "default": [],
          "type": "array",
          "items": {
            "type": "string"
          }
        },
        "criticalAreas": {
          "default": [],
          "type": "array",
          "items": {
            "type": "string"
          }
        },
        "criticalPaths": {
          "default": [],
          "type": "array",
          "items": {
            "type": "string"
          }
        },
        "testRunner": {
          "type": "string"
        },
        "posture": {
          "type": "string"
        },
        "reviewRigor": {
          "type": "string"
        },
        "architectureRule": {
          "type": "string"
        },
        "testsForNewCode": {
          "type": "string"
        },
        "testsExclude": {
          "default": [],
          "type": "array",
          "items": {
            "type": "string"
          }
        },
        "localSkills": {
          "default": [],
          "type": "array",
          "items": {
            "type": "string"
          }
        },
        "foreignHarness": {
          "type": "object",
          "properties": {
            "acknowledged": {
              "default": [],
              "type": "array",
              "items": {
                "type": "string"
              }
            }
          },
          "required": [
            "acknowledged"
          ],
          "additionalProperties": {}
        },
        "libraries": {
          "default": [],
          "type": "array",
          "items": {
            "type": "string"
          }
        },
        "extraLibraries": {
          "type": "array",
          "items": {
            "type": "string",
            "minLength": 1
          }
        },
        "libraryMigrations": {
          "default": [],
          "type": "array",
          "items": {
            "type": "object",
            "properties": {
              "legacy": {
                "type": "string"
              },
              "preferred": {
                "type": "string"
              },
              "domain": {
                "type": "string"
              }
            },
            "required": [
              "legacy",
              "preferred",
              "domain"
            ],
            "additionalProperties": false
          }
        },
        "codeLanguage": {
          "type": "string"
        }
      },
      "required": [
        "legacyPaths",
        "criticalAreas",
        "criticalPaths",
        "testsExclude",
        "localSkills",
        "libraries",
        "libraryMigrations"
      ],
      "additionalProperties": {}
    },
    "monorepo": {
      "type": "object",
      "properties": {
        "enabled": {
          "type": "boolean"
        },
        "tool": {
          "type": "string",
          "enum": [
            "pnpm",
            "turbo",
            "nx",
            "rush",
            "lerna",
            "npm"
          ]
        },
        "workspaces": {
          "default": [],
          "type": "array",
          "items": {
            "type": "object",
            "properties": {
              "name": {
                "type": "string",
                "minLength": 1,
                "pattern": "^[^<>\\r\\n]+$"
              },
              "path": {
                "type": "string",
                "minLength": 1
              },
              "preset": {
                "type": "string"
              },
              "qualityGate": {
                "type": "object",
                "properties": {
                  "fast": {
                    "type": "string",
                    "minLength": 1
                  },
                  "full": {
                    "type": "string",
                    "minLength": 1
                  },
                  "scoped": {
                    "type": "string",
                    "minLength": 1
                  },
                  "affected": {
                    "type": "string",
                    "minLength": 1
                  },
                  "docs": {
                    "type": "string",
                    "minLength": 1
                  },
                  "nativeHooks": {
                    "type": "boolean"
                  }
                },
                "required": [
                  "fast",
                  "full"
                ],
                "additionalProperties": false
              },
              "libraries": {
                "type": "array",
                "items": {
                  "type": "string"
                }
              },
              "extraLibraries": {
                "type": "array",
                "items": {
                  "type": "string",
                  "minLength": 1
                }
              },
              "libraryMigrations": {
                "type": "array",
                "items": {
                  "type": "object",
                  "properties": {
                    "legacy": {
                      "type": "string"
                    },
                    "preferred": {
                      "type": "string"
                    },
                    "domain": {
                      "type": "string"
                    }
                  },
                  "required": [
                    "legacy",
                    "preferred",
                    "domain"
                  ],
                  "additionalProperties": false
                }
              }
            },
            "required": [
              "name",
              "path"
            ],
            "additionalProperties": false
          }
        },
        "workspaceHarness": {
          "default": "minimal",
          "description": "How much harness each workspace gets. minimal (default): its context file plus the skills the root does not already have. full: everything, as before. root: only its context file; the root also writes the workspaces' library and preset skills. Requires a navori that knows `root` on every machine and in CI.",
          "type": "string",
          "enum": [
            "minimal",
            "full",
            "root"
          ]
        }
      },
      "required": [
        "enabled",
        "workspaces",
        "workspaceHarness"
      ],
      "additionalProperties": false
    }
  },
  "required": [
    "name",
    "version",
    "engines",
    "preset",
    "language",
    "branchBase",
    "gitignoreHarness",
    "commits",
    "audit"
  ],
  "additionalProperties": {}
}
